{
  "apiVersion": "doppels.so/v1alpha1",
  "kind": "Request",
  "id": "18792d62-262c-4fa7-9724-f4dd75c88282",
  "createdAt": "2026-08-01T11:00:00Z",
  "idempotencyKey": "local:service-status:manual:1",
  "origin": "cli",
  "capability": {
    "name": "service-status",
    "version": "1.0.0",
    "manifestSha256": "76239f7fbae520f54b023c958c148dbaf20b640e852e14b6b3299ea64b7e7077",
    "schema": {
      "id": "https://doppels.so/schemas/v1alpha1/capability.schema.json",
      "sha256": "ff3f2d681a8c724674d040a9e948fbb88710cabcbc37df46092f07f7324959d8"
    }
  },
  "inputs": {
    "endpoint": "https://status.example.test/health"
  },
  "requestedBy": {
    "kind": "identity",
    "id": "ana@example.test"
  },
  "assignedTo": {
    "kind": "identity",
    "id": "carlos@example.test"
  },
  "organization": "acme",
  "space": "personal"
}
